Sno,"Party Name","Party Account no","Party Bank Name","Party Bank Branch","Party Bank 
Ifsc Code","Party Amount"
01,"THARUNI ASSOCIATES GUNTUR",1453280000001034,"KARUR VYSYA BANK LTD",GUNTUR,KVBL0001453,232500
02,"KALANGI NAGESWARAO ONGOLE",330701010021057,"UNION BANK OF INDIA",ONGOLE,UBIN0533076,96040
03,"SRI VIJETHA IRRIGATION PVT LTD HYDERABAD",30551250000621,"SYNDICATE BANK",HYDERABAD,SYND0003055,530184
04,"EPC INDUSTRIES PVT LTD HYDERABAD",002184100000025,"YES BANK LIMITED",NASIK,YESB0000021,313072
05,"KOTHARI AGRI TECH PVT LTD HYDERABAD",070130110000084,"BANK OF INDIA",SOLAPUR,BKID0000701,1344150
06,"SRI HARITHA ENTERPRISES GUNTUR",05170500029281,"BANK OF BARODA",GUNTUR,"BARB 0 GUNTUR",80000
07,"SRI VENKATA SIVA SAI AGRO INDUSTRIES DARSI",30414014080,"STATE BANK OF INDIA",DARSI,SBIN0006694,76000
