Sno,Party Name,Party Account no,Party Bank Name,Party Bank Branch,Party Bank Ifsc Code,Party Amount
1,"M/s. Indian Drugs & Pharmaceuticals Ltd.,",116601601000002,"Corporation Bank, ","Balanagar Branch, Hyderabad",CORP0001166,11193352
2,M/s. Seeko Biotics,1441135000000669,"The Karur Vysya Bank Ltd., ","Bunder Rd., Vijayawada",KVBL0001441,3133801
3,M/s. Celon Laboratories Limited,000805012955,"ICICI Bank Ltd., ","6-2-1012, Tgv Mansion, Khairathabad, Hyderabad.",ICIC0000008,30040
4,M/s. Century Pharmalabs India Private Limited,1439135000003758,"The Karur Vysya Bank Limited, ","Nallakunta , Hyderabad",KVBL0001439,290680
5,"M/s. Ravian Life Science Pvt., Ltd.",2726008700003412,"Punjab National Bank , ","Sector-27, UP",PUNB0272600,41316
6,"M/s. Intas Pharmaceuticals Ltd.,",002451000069,"ICICI Bank Ltd., ","JMC House, Off. C G Road, Ahmedabad.",ICIC0000024,18603
7,"MD, APMSIDC, Hyderabad ",142410011000314,"Andhra Bank, ","Kendriya sadan Branch., Hyderabad",ANDB0001424,1029545
